{
  "project": "형벌 용어 정리 — 카드뉴스 5장",
  "canvas": { "width": 1080, "height": 1350 },
  "prd": {
    "mode": "역구성",
    "oneLine": "판결 기사에서 자주 보는 형벌 용어의 차이를 비교로 정리한 정보형 카드뉴스",
    "goal": "저장하게 만든다. 다시 볼 이유가 있는 정보를 준다",
    "background": "판결 기사는 형벌 이름만 알려주고 뜻을 설명하지 않는다. 독자는 금고형을 벌금 내는 처벌로 오해한 채 기사를 읽는다.",
    "problems": [
      "금고형을 벌금형으로 오해한다",
      "실형이 형벌 이름인 줄 안다",
      "용어를 찾아봐도 법조문 문장이라 이해가 안 된다"
    ],
    "target": {
      "persona": "판결 기사를 읽다 용어에서 막히는 일반 독자",
      "situation": "뉴스에서 형벌 이름을 보고 뜻이 궁금해진 순간",
      "awareness": "문제인식",
      "desire": "기사를 정확히 이해하는 것"
    },
    "coreMessage": "금고형과 징역형의 차이는 작업 의무의 유무다",
    "tone": "단정적으로. 오해를 먼저 깨고 정답을 준다. 법조문 문장을 쓰지 않는다",
    "success": [
      { "goal": "저장을 유도한다", "metric": "저장 수" },
      { "goal": "비교 카드까지 도달시킨다", "metric": "3번째 카드 도달률" }
    ],
    "scope": {
      "in": ["금고형·징역형·벌금형·실형 4종", "작업 의무 기준 비교", "판결 기사 읽는 법"],
      "out": ["형량 산정 기준 — 사안마다 달라 일반화 불가", "개별 사건 언급 — 법적 리스크"]
    },
    "improvements": [
      "4종을 두 카드에 나눠 담아 마지막 요약표가 과밀해졌다. 종류별로 한 장씩 쓰는 편이 나았다",
      "표지에서 '차이는?'으로 질문만 던지고 오해를 깨지 않았다. 2번 카드의 '벌금 내는 처벌이 아닙니다'를 표지로 올렸으면 더 멈춘다"
    ]
  },
  "features": [
    { "no": "1", "name": "도입 설계", "desc": "용어 4종을 한 번에 예고한다",
      "children": [
        { "no": "1.1", "name": "INFO 배지", "desc": "정보형임을 즉시 알림", "cards": ["C1"] },
        { "no": "1.2", "name": "검색바 모티프", "desc": "찾아보던 상황을 시각으로 재현", "cards": ["C1"] }
      ] },
    { "no": "2", "name": "오해 정정", "desc": "잘못된 전제를 먼저 깬다",
      "children": [
        { "no": "2.1", "name": "부정 헤드라인", "desc": "~가 아닙니다 구조", "cards": ["C2"] },
        { "no": "2.2", "name": "2열 비교", "desc": "금고형 대 징역형", "cards": ["C2"] }
      ] },
    { "no": "3", "name": "차이 정리", "desc": "판단 기준을 하나로 압축한다",
      "children": [
        { "no": "3.1", "name": "요약 박스", "desc": "차이의 핵심 한 줄", "cards": ["C2", "C3"] },
        { "no": "3.2", "name": "4종 요약표", "desc": "저장 유도 지점", "cards": ["C3"] }
      ] }
  ],
  "flow": {
    "groups": [
      { "name": "진입", "nodes": [
        { "id": "N1", "label": "판결 기사 열람", "type": "start" },
        { "id": "N2", "label": "C1 용어 질문", "type": "card" }
      ] },
      { "name": "이해", "nodes": [
        { "id": "N3", "label": "C2 오해 정정", "type": "card" },
        { "id": "N4", "label": "C3 4종 비교", "type": "card" }
      ] },
      { "name": "전환", "nodes": [
        { "id": "N5", "label": "저장", "type": "action" },
        { "id": "N6", "label": "이탈", "type": "exit" }
      ] }
    ],
    "edges": [
      { "from": "N1", "to": "N2" },
      { "from": "N2", "to": "N3" },
      { "from": "N3", "to": "N4" },
      { "from": "N4", "to": "N5", "label": "다시 볼 정보" },
      { "from": "N2", "to": "N6", "label": "관심 없음" }
    ],
    "dropoff": "표지에서 2번 카드로 넘어가는 지점. 표지가 질문만 던지고 오해를 깨지 않아서, 이미 안다고 생각하는 독자는 넘기지 않는다."
  },
  "cards": [
    {
      "id": "C1", "role": "후킹", "angle": "편의", "layout": "cover",
      "badge": "INFO",
      "why": "검색바 모티프로 '찾아보던 중'이라는 상황을 재현한다. 독자가 이미 하던 행동을 화면에 보여주면 자기 이야기로 읽는다.",
      "headline": "금고형·벌금형·실형\n뜻과 차이는?",
      "sub": "판결 기사에서 자주 보는 형벌 용어를 한눈에 정리했습니다",
      "body": [],
      "cta": null
    },
    {
      "id": "C2", "role": "문제 제기", "angle": "공감", "layout": "compare",
      "badge": "오해 정정",
      "why": "가장 흔한 오해를 먼저 깬다. 부정문으로 시작해야 이미 안다고 믿는 독자가 멈춘다.",
      "headline": "금고형 뜻은?\n벌금을 내는 처벌이 아닙니다",
      "sub": "금고형이란 교정시설에 수감되는 자유형입니다",
      "compare": {
        "left": { "label": "금고형", "items": ["교정시설에 수감", "작업 의무 없음", "희망 시 작업 참여 가능"] },
        "right": { "label": "징역형", "items": ["교정시설에 수감", "작업 의무 있음", "형기 중 노역 부과"] }
      },
      "summary": "둘 다 신체의 자유를 제한하며, 가장 큰 차이는 작업 의무의 유무입니다",
      "cta": null
    },
    {
      "id": "C3", "role": "해법", "angle": "편의", "layout": "compare",
      "badge": "차이 정리",
      "why": "이 세트에서 저장이 걸리는 장. 네 종류를 한 화면에 놓아 다시 볼 이유를 만든다.",
      "headline": "벌금형과 실형\n무엇이 다를까요?",
      "sub": "실형은 형벌의 이름이 아니라 실무상 표현입니다",
      "compare": {
        "left": { "label": "벌금형", "items": ["국가에 일정 금액 납부", "과태료와 다른 형사처벌", "재산형에 해당"] },
        "right": { "label": "실형", "items": ["형벌 이름이 아닌 표현", "집행유예 없이 집행", "징역·금고형에 붙는 말"] }
      },
      "summary": "판결 기사는 형벌 이름뿐 아니라 형기와 집행유예 여부까지 봐야 합니다",
      "cta": null
    },
    {
      "id": "C4", "role": "CTA", "angle": "편의", "layout": "cta",
      "why": "행동을 하나만 요구한다. 정보형은 저장이 목적이므로 팔로우와 저장을 함께 시키지 않는다.",
      "headline": "헷갈리는 법률 용어,\n쉽게 정리해드립니다",
      "sub": "판결 기사를 정확히 읽는 법",
      "body": [],
      "cta": "저장하고 다시 보기"
    }
  ]
}
