{
  "project": "로얄베이비 EZ 바이크 프로 — 카드뉴스 4장",
  "canvas": { "width": 1080, "height": 1350 },

  "prd": {
    "oneLine": "어린이 첫 자전거 EZ 바이크 프로를 안전성과 사이즈 기준으로 소개하는 인스타그램 4:5 카드뉴스 4장",
    "goal": "부모가 우리 아이 사이즈를 자기 상황에 대입해보고 구매 검토 단계로 진입하게 한다",
    "background": "어린이 자전거는 부모가 사고 아이가 타는 제품이다. 구매 저항은 가격이 아니라 안전과 사이즈에 있다. 부모는 발이 안 닿을까, 금방 작아질까를 먼저 걱정하지만 제품 페이지는 대개 스펙부터 나열한다.",
    "problems": [
      "몇 인치를 사야 하는지 판단할 기준이 없다",
      "안전한 제품인지 확인할 방법이 브랜드 주장뿐이다",
      "아이가 금방 커서 다시 사야 할까 봐 결정을 미룬다"
    ],
    "target": {
      "persona": "만 3~6세 자녀의 첫 자전거를 알아보는 부모",
      "situation": "인스타 피드를 넘기다 자전거 탄 아이 사진에 멈춘 순간",
      "awareness": "문제인식",
      "desire": "아이가 다치지 않고, 몇 년은 탈 수 있는 자전거를 고르는 것"
    },
    "coreMessage": "14인치는 키 100~110cm 아이를 위한 사이즈다",
    "tone": "부모에게 말 걸듯 담백하게. 아이 사진으로 감정을 주고 문구는 정보만 전달한다",
    "success": [
      { "goal": "스크롤을 멈추게 한다", "metric": "노출 대비 프로필 방문율" },
      { "goal": "사이즈 카드까지 도달시킨다", "metric": "3번째 카드 도달률" },
      { "goal": "저장을 유도한다", "metric": "저장 수 (사이즈 표는 다시 볼 정보)" },
      { "goal": "팔로우로 남긴다", "metric": "게시물 유입 팔로우 수" }
    ],
    "scope": {
      "in": ["14인치 단일 사이즈", "안전 스펙과 2단계 모드", "연령·키·인심 기준표", "팔로우 CTA"],
      "out": [
        "가격과 구매 링크 — 팔로우 전환을 단일 행동으로 유지하기 위해 제외",
        "12·16·18인치 라인 — 한 세트에 여러 사이즈를 넣으면 자기 대입이 흐려짐",
        "조립·AS 안내 — 구매 이후 단계라 이번 목적과 무관"
      ]
    },
    "improvements": [
      "문제 제기 카드가 없다. 카드2가 부모의 불안을 해소하는데, 그 불안을 먼저 꺼내는 카드가 앞에 없어 안심시킬 대상이 비어 있다",
      "카드2가 과부하다. 안전 스펙 3종과 2단계 모드 전환은 성격이 다른 메시지인데 한 장에 함께 들어가 있어 어느 쪽도 각인되지 않는다",
      "카드3에서 카드4로 넘어갈 때 수치 정보에서 감성 슬로건으로 전환이 급격하다. 사이에 신뢰를 잇는 카드가 필요하다",
      "손글씨체가 카드1~2에만 쓰이고 3~4는 고딕이다. 타이포 규칙이 세트 안에서 지켜지지 않았다"
    ]
  },

  "features": [
    {
      "no": "1", "name": "도입 설계", "desc": "스크롤을 멈추고 이 세트가 무엇인지 알린다",
      "children": [
        { "no": "1.1", "name": "후킹 카피", "desc": "아이와 부모 양쪽을 수신자로 선언", "cards": ["C1"] },
        { "no": "1.2", "name": "대표 액션 이미지", "desc": "점프 컷으로 감정을 먼저 준다", "cards": ["C1"] },
        { "no": "1.3", "name": "브랜드 라벨", "desc": "제품 소개임을 명시", "cards": ["C1"] }
      ]
    },
    {
      "no": "2", "name": "안전 근거 제시", "desc": "부모의 구매 저항 지점을 정면으로 다룬다",
      "children": [
        { "no": "2.1", "name": "인증 기반 스펙 3종", "desc": "높이조절 · 실드베어링 · V브레이크", "cards": ["C2"] },
        { "no": "2.2", "name": "2단계 모드 전환", "desc": "밸런스에서 페달링으로", "cards": ["C2"] }
      ]
    },
    {
      "no": "3", "name": "사이즈 가이드", "desc": "자기 아이에게 대입할 수 있는 기준을 준다",
      "children": [
        { "no": "3.1", "name": "14인치 대응표", "desc": "나이 · 키 · 인심 3축", "cards": ["C3"] },
        { "no": "3.2", "name": "색상 3종 제품샷", "desc": "선택지를 시각으로 제시", "cards": ["C3"] }
      ]
    },
    {
      "no": "4", "name": "전환 유도", "desc": "지금 사지 않는 사람을 놓치지 않는다",
      "children": [
        { "no": "4.1", "name": "브랜드 슬로건", "desc": "제품에서 브랜드로 시선 이동", "cards": ["C4"] },
        { "no": "4.2", "name": "팔로우 CTA", "desc": "단일 행동만 요구", "cards": ["C4"] },
        { "no": "4.3", "name": "가치 키워드 바", "desc": "브랜드 인상을 마지막에 남긴다", "cards": ["C4"] }
      ]
    }
  ],

  "flow": {
    "groups": [
      {
        "name": "진입",
        "nodes": [
          { "id": "N1", "label": "피드 노출", "type": "start" },
          { "id": "N2", "label": "C1 후킹", "type": "card" },
          { "id": "N3", "label": "스와이프 시작", "type": "action" }
        ]
      },
      {
        "name": "탐색",
        "nodes": [
          { "id": "N4", "label": "C2 안전 확인", "type": "card" },
          { "id": "N5", "label": "C3 사이즈 대입", "type": "card" },
          { "id": "N6", "label": "저장", "type": "action" }
        ]
      },
      {
        "name": "전환",
        "nodes": [
          { "id": "N7", "label": "C4 CTA", "type": "card" },
          { "id": "N8", "label": "프로필 방문", "type": "action" },
          { "id": "N9", "label": "이탈", "type": "exit" }
        ]
      }
    ],
    "edges": [
      { "from": "N1", "to": "N2" },
      { "from": "N2", "to": "N3" },
      { "from": "N3", "to": "N4" },
      { "from": "N4", "to": "N5" },
      { "from": "N5", "to": "N6", "label": "사이즈 맞음" },
      { "from": "N5", "to": "N7" },
      { "from": "N7", "to": "N8", "label": "팔로우" },
      { "from": "N4", "to": "N9", "label": "관심 없음" }
    ],
    "dropoff": "카드1에서 카드2로 넘어가는 지점. 후킹 다음에 바로 스펙이 나와서, 아직 자기 문제라고 느끼지 않은 독자는 여기서 스와이프를 멈춘다."
  },

  "cards": [
    {
      "id": "C1", "role": "후킹", "angle": "공감", "layout": "cover",
      "why": "제품명과 수신자를 첫 장에서 선언한다. 아이용 안전과 부모용 편의를 함께 걸어야 이후 카드가 양쪽으로 이어진다.",
      "headline": "아이들을 위한 쉽고 안전한",
      "sub": "EZ 바이크 프로 제품 소개",
      "body": [],
      "cta": null
    },
    {
      "id": "C2", "role": "근거", "angle": "권위", "layout": "list",
      "why": "부모의 구매 저항은 가격이 아니라 안전이다. 사이즈 정보보다 먼저 안전을 해소해야 3번 카드를 진지하게 본다.",
      "headline": "글로벌 인증으로 검증된 안전 기능",
      "sub": "밸런스 모드로 시작해 페달링 모드로 전환합니다",
      "body": [
        "성장에 맞춰 조절되는 안장·핸들 높이",
        "부드러운 주행을 위한 실드 베어링",
        "작은 힘으로 멈추는 V-BRAKE",
        "2 IN 1 밸런스 & 페달링 시스템"
      ],
      "cta": null
    },
    {
      "id": "C3", "role": "해법", "angle": "편의", "layout": "table",
      "why": "이 세트에서 저장과 공유가 걸리는 단 한 장. 표가 정보 밀도의 정점이 되도록 다른 요소를 덜어냈다.",
      "headline": "14인치 사이즈는?",
      "sub": "인심은 발바닥에서 사타구니 안쪽까지의 길이입니다",
      "body": [
        "권장 나이 · 3~6세",
        "권장 키 · 100~110cm",
        "권장 인심 길이 · 44~52cm"
      ],
      "cta": null
    },
    {
      "id": "C4", "role": "CTA", "angle": "혜택", "layout": "cta",
      "why": "행동을 하나만 요구한다. 구매와 저장을 동시에 시키면 둘 다 하지 않는다. 지금 사지 않는 사람을 남기는 장치다.",
      "headline": "모든 아이의 첫 자전거",
      "sub": "PASSION · EXPLORATION · SAFETY · GROWTH",
      "body": [],
      "cta": "팔로우하고 더 받아보기"
    }
  ]
}
